brand,product,product_price
에잇세컨즈,베이직 라운드넥 반소매 티셔츠 화이트 (324242LY11),14900
에잇세컨즈,베이직 스트라이프 티셔츠 화이트 (423141LY41),14950
에잇세컨즈,블랙 투포켓 옴브레 체크 셔츠 (262964EY15),24950
에잇세컨즈,골조직 스트라이프 티셔츠 아이보리 (423141FY10),19950
에잇세컨즈,[리넨 블렌디드] 오픈칼라 반팔 셔츠 브라운 (423565LY9D),14900
에잇세컨즈,브라운 스카시 칼라 니트 풀오버 (452951LQ8D),24950
에잇세컨즈,메쉬 스트라이프 니트 베이지 (423251HY4A),29950
에잇세컨즈,라운드넥 반팔 니트 그린 (423451LY5M),14900
에잇세컨즈,골지 자수 슬리브리스 화이트 (454542JQ61),12900
에잇세컨즈,데일리 포플린 오버핏 셔츠 아이보리 (423364GY70),19950
에잇세컨즈,[매일슬랙스] 베이직 세미와이드핏 슬랙스 블랙 (423721LY15),16900
에잇세컨즈,코튼 퍼티그 팬츠 카키 (423X21LY7H),35940
에잇세컨즈,코튼 원턱 와이드 팬츠 베이지 (263321CY1A),29950
에잇세컨즈,경량 데님 루즈 테이퍼드 팬츠 스카이블루 (423421GP4Q),24950
에잇세컨즈,경량 테이퍼드 워싱 데님 팬츠 애쉬 (423421LP34),24950
에잇세컨즈,시어서커 릴렉스핏 밴딩 팬츠 블랙 (423721LY45),20900
에잇세컨즈,[매일슬랙스] 베이직 슬림핏 슬랙스 블랙 (423721LY25),16900
에잇세컨즈,에센셜 테이퍼드핏 데님 팬츠 스카이 블루 (423121GP2Q),24950
에잇세컨즈,워싱 데님 와이드 팬츠 스카이 블루 (323321EPGQ),29900
에잇세컨즈,빈티지 워싱 와이드핏 데님 팬츠 애쉬 (263X21EP94),35940
에잇세컨즈,에센셜 데님 트러커 블루 (424139GPDP),39900
에잇세컨즈,솔리드 더블 재킷 네이비 (423311HY1R),54950
에잇세컨즈,코튼 트윌 캐주얼 블루종 베이지 (423939FY2A),33900
에잇세컨즈,헤비 트윌 드리즐러 재킷 베이지 (423239LY1A),39950
에잇세컨즈,코튼 트윌 캐주얼 블루종 네이비 (423939FY2R),47940
에잇세컨즈,에센셜 데님 워크무드 재킷 아이보리 (423239LP10),34950
에잇세컨즈,이중직 버튼 카디건 블랙 (42395ALY15),25900
에잇세컨즈,에센셜 데님 트러커 에쉬 (424139GPD4),39900
에잇세컨즈,논페이드 데님 트러커 라이트 그레이 (423339HP92),39950
에잇세컨즈,[REVERSIBLE] 블랙 플리스 양면 퀼팅 점퍼 (422X39LY15),39950
무신사 스탠다드,레이어드 크루 넥 반팔 티셔츠_일반 기장 [화이트],16900
무신사 스탠다드,베이식 긴팔 티셔츠 2팩,33990
무신사 스탠다드,릴렉스 핏 크루 넥 반팔 티셔츠 2팩,26990
무신사 스탠다드,릴렉스 핏 크루 넥 반팔 티셔츠 [화이트],15900
무신사 스탠다드,레이어드 크루 넥 반팔 티셔츠_일반 기장 2팩,23590
무신사 스탠다드,[쿨탠다드] 릴렉스 핏 크루 넥 반팔 티셔츠 2팩,31790
무신사 스탠다드,레이어드 크루 넥 반팔 티셔츠_긴 기장 [화이트],13490
무신사 스탠다드,베이식 크루 넥 반팔 티셔츠 2팩,24990
무신사 스탠다드,스웨트셔츠 [블랙],29900
무신사 스탠다드,릴렉스 핏 크루 넥 반팔 티셔츠 [블랙],15900
무신사 스탠다드,세미 와이드 히든 밴딩 슬랙스 [블랙],31890
무신사 스탠다드,와이드 히든 밴딩 슬랙스 [블랙],33490
무신사 스탠다드,테이퍼드 히든 밴딩 크롭 슬랙스 [블랙],25890
무신사 스탠다드,[쿨탠다드] 세미 와이드 히든 밴딩 슬랙스 [블랙],33490
무신사 스탠다드,스트레이트 데님 팬츠 [라이트 인디고],39890
무신사 스탠다드,와이드 히든 밴딩 슬랙스 [미디엄 그레이],35590
무신사 스탠다드,레플리카 퍼티그 팬츠 [카키],43900
무신사 스탠다드,스트레이트 데님 팬츠 [크림],37390
무신사 스탠다드,[쿨탠다드] 와이드 히든 밴딩 슬랙스 [블랙],35090
무신사 스탠다드,라운지 스웨트 팬츠 [블랙],31900
무신사 스탠다드,릴렉스드 베이식 블레이저 [블랙],69590
무신사 스탠다드,데일리 푸퍼 숏 패딩 재킷 [블랙],69900
무신사 스탠다드,오버사이즈 블레이저 [블랙],67090
무신사 스탠다드,베이식 블레이저 [블랙],63890
무신사 스탠다드,후디드 스웨트 집업 [멜란지 그레이],35090
무신사 스탠다드,다운 푸퍼 숏 패딩 재킷 [블랙],119900
무신사 스탠다드,캐시미어 블렌드 오버사이즈 싱글 코트 [블랙],159900
무신사 스탠다드,캐시미어 블렌드 오버사이즈 발마칸 코트 [블랙],199900
무신사 스탠다드,캐시미어 블렌드 맥시 발마칸 코트 [블랙],188890
무신사 스탠다드,릴렉스드 베이식 블레이저 [미디엄 그레이],81900
스파오,오버핏 옥스포드 셔츠_SPYWE23C51,35910
스파오,(우디) 헤리티지 반팔티_SPRPE37C51,14900
스파오,오버핏 반팔 옥스포드 셔츠_SPYWE38C41,32310
스파오,[2PACK] 코튼 베이직 반팔_SPRWEA9A01,15900
스파오,[2PACK] 레이어드용 롱기장 반팔_SPRWEA9A02,25900
스파오,피그먼트 반팔티셔츠_SPRWE37C05,17910
스파오,[COMFORT] 남성 심리스 V넥 반팔_SPMREA9A12,9900
스파오,[COOL] 오픈카라 반팔니트_SPKWE37M06,29900
스파오,[2PACK] 쿨코튼 루즈핏 반팔_SPRWEA9A03,14900
스파오,[UV차단] 폴로카라 반팔티셔츠_SPHWE24M01,9900
스파오,[데일리지] 와이드 진_SPTJE23C51,46407
스파오,라이트 와이드 카고 팬츠 (나일론)_SPTCE23C11,29900
스파오,빈티지 와이드 진_SPTJE23C56,44910
스파오,[데일리지] 롱 와이드 진_SPTJEA9G51,44910
스파오,카펜터 와이드 진 _SPTJE23C91,39900
스파오,[데일리지] 와이드 진_SPTJD49C51,49900
스파오,여성 라이트 쇼츠 (나일론)_SPTHE37G01,14900
스파오,[COOL] 와이드 진_SPTJE25C51,39900
스파오,라이트 2-WAY 카고 와이드 팬츠 (나일론)_SPTCE23G01,29900
스파오,[남녀공용] 데님 밴딩 쇼츠 (셋업)_SPTNE37C01,29900
스파오,베이직 푸퍼_SPJPE4TC11,62910
스파오,베이직 퍼플리스 집업_SPFZE11C01,14900
스파오,파스텔 푸퍼_SPJPE4TG01,62910
스파오,[UV차단] 라이트 패커블 윈드브레이커_SPJJE25C21,29900
스파오,라이트 재킷_SPJPE4TC01,53910
스파오,후드 윈드브레이커_SPJJE23C24,39900
스파오,[프렌치테리] 2-WAY 루즈핏 후드집업_SPMZE12C71,19950
스파오,[울블렌드]발마칸 코트_ SPJWD4VM02,79900
스파오,[소프트코튼] 크롭 후드집업_SPMZE23G01,25100
스파오,[담곰이] 담곰이 라이트 윈드브레이커_SPJJE25U01,39900
탑텐,공용) 코튼 베이직 반팔티 3PACK_MSE5TS3001,19900
탑텐,남성) 쿨에어 코튼 피케 폴로셔츠_MSD2TT3001,9900
탑텐,공용) 폴라플리스 스웨트 후디_MSC4TH3903,19900
탑텐,남성) 쿨에어 코튼 반팔 티 (오버핏)_MSD2TS1001,9900
탑텐,공용) 테리 그래픽 스웨트셔츠_MSE1TR3902,9900
탑텐,남성) 텍스쳐드 긴팔 티_MSD3TS1902,12900
탑텐,남성) 쿨에어 코튼 폴로셔츠_MSD2TT1002,12900
탑텐,공용) 헤비웨이트 코튼 반팔 티 (오버핏)_MSD2TS3905,9900
탑텐,공용) 오가닉 코튼 브이넥 반팔 티_MSD2TV3901,9900
탑텐,공용) 코튼 레이어드 반팔티 (2PACK)_MSE5TS3002,19900
탑텐,남성) 레귤러핏 치노 팬츠_MSD3PP1001,19900
탑텐,남성) 와이드 슬랙스_MSD2PP1504,15900
탑텐,남성) 와이드 슬랙스_MSD3PP1503,19900
탑텐,남성) 와이드 카고 팬츠_MSD3PP1201,19900
탑텐,남성) 베러 코튼 밴딩 쇼츠_MSE2PH1201,9900
탑텐,남성) 쿨터치 슬림 슬랙스(SET MSD2KG1501)_MSD2PP1501,15900
탑텐,여성) 베러 코튼 밴딩 쇼츠_MSE2PH2201,9900
탑텐,여성) 밸런스 기모 와이드 팬츠_MSD5PT2216,19900
탑텐,남성) 슬림 치노 팬츠_MSD2PP1001,15900
탑텐,남성) 코튼 카고 밴딩 조거_MSD2PP1205,15900
탑텐,여성) 에코 쉘파 베스트_MSC4TC2004,19900
탑텐,공용) 에코 플러피플리스 하이넥 집_MSC4TC3912,19900
탑텐,여성) 울블렌드 블레이저_MSC4KG2501,49900
탑텐,여성) 쉘파 퀼팅 점퍼_MSC4JP2805,49900
탑텐,남성) 쿨터치 세미오버핏 재킷 (SET MSD2PP1206)_MSD2KG1206,25900
탑텐,여성) 쿨에어 코튼 크루넥 버튼 가디건_MSE5TC2901,15900
탑텐,여성) 텍스쳐드 카라 가디건_MSD2TC2051,12900
탑텐,여성) 케이블 스웨터 베스트_MSE1ES2901,12900
탑텐,여성) 쿨터치 재킷 (SET MSD2PP2502)_MSD2KG2502,25900
탑텐,남성) 쿨터치 싱글 재킷 (SET MSD2PP1501)_MSD2KG1501,25900
